{"backtest_report_sha256":"7d31df5a3947486a905ae4f465987d5f313f4d41ea2af8245fc4ffbd237532f5","checks":{"adjustment_safe":false,"development_completed":false,"execution_status_complete":false,"formal_dataset_complete":false,"locked_test_not_run":true,"pit_membership_complete":false,"validation_completed":false},"dataset_manifest_sha256":"b7419abd4acde36e5b7093c8619194b051a7e46e361808279c94a61c291b299b","generated_at":"2026-08-28T12:18:46+08:00","locked_test_consumed":false,"locked_test_status":"NOT_RUN","readiness_sha256":"9bf4dfbcea850b4e7a874ee46190e519d0d306a7468674c92c5247fe66f0e14f","remaining_blockers":["adjustment_factor:issues_present","adjustment_factor:missing_dates","adjustment_factor:status_partial","adjustment_factor:warmup_or_start_coverage_missing","capability_receipt_scope_not_formal_admission","corporate_action_entitlement_decomposition_out_of_scope","critical_check_failed:adjustment_point_in_time_valid","critical_check_failed:corporate_action_entitlements_complete","critical_check_failed:date_order_valid","critical_check_failed:dual_price_isolated","critical_check_failed:execution_states_complete","critical_check_failed:no_duplicate_primary_keys","critical_check_failed:pit_membership_complete","csi800_pit_membership:end_coverage_missing","csi800_pit_membership:issues_present","csi800_pit_membership:missing_dates","csi800_pit_membership:status_partial","csi800_pit_membership:warmup_or_start_coverage_missing","csi800_price_benchmark:issues_present","csi800_price_benchmark:missing_dates","csi800_price_benchmark:status_partial","csi800_price_benchmark:warmup_or_start_coverage_missing","delisted_residual_terminal_valuation_not_admitted","development:formal_dataset_blocked","development:standard_cli_controlled_backtest_not_implemented","historical_formal_batches_not_collected","name_and_st_history:content_hash_missing","name_and_st_history:end_coverage_missing","name_and_st_history:issues_present","name_and_st_history:missing_dates","name_and_st_history:no_records","name_and_st_history:status_missing","name_and_st_history:warmup_or_start_coverage_missing","price_limit_history:issues_present","price_limit_history:missing_dates","price_limit_history:status_invalid","price_limit_history:warmup_or_start_coverage_missing","raw_daily_bar:issues_present","raw_daily_bar:missing_dates","raw_daily_bar:status_partial","raw_daily_bar:warmup_or_start_coverage_missing","readiness_check_failed:adjustment_safe","readiness_check_failed:development_completed","readiness_check_failed:execution_status_complete","readiness_check_failed:formal_dataset_complete","readiness_check_failed:pit_membership_complete","readiness_check_failed:validation_completed","security_master:end_coverage_missing","security_master:issues_present","security_master:missing_dates","security_master:status_invalid","security_master:warmup_or_start_coverage_missing","standard_cli_raw_dataset_verification_not_implemented","suspension_history:issues_present","suspension_history:missing_dates","suspension_history:status_partial","suspension_history:warmup_or_start_coverage_missing","trade_calendar:issues_present","trade_calendar:missing_dates","trade_calendar:status_partial","trade_calendar:warmup_or_start_coverage_missing","validation:formal_dataset_blocked","validation:standard_cli_controlled_backtest_not_implemented"],"safety":{"automatic_order_submission":false,"live_supported":false,"paper_eligibility":false,"real_money_list_allowed":false,"trade_eligibility":false},"schema_version":"technical-locked-test-readiness.v1","strategy_id":"a-share-technical-momentum-adaptive-v1","verdict":"BLOCKED"}
